ProjectID,RequirementText,Class,IsFunctional,IsQuality,IsOnlyFunctional,IsOnlyQuality,F+Q,NotR
11,the system shall be responsive at the depaul teleservices center when a supervisor uses the system to view a callers schedule the system response time must be no more than 2 seconds 90 of the time and no more than 5 seconds the rest of the time,FR,0,1,0,1,0,0
1,the system shall display the events in a graph by time,FR,1,0,1,0,0,0
2,the product shall be able support 1000 simultaneous users,FR,0,1,0,1,0,0
6,the product shall have a conservative and professional appearance,FR,0,1,0,1,0,0
8,the product shall be expected to operate within the maximum maintenance budget for a minimum of 2 years,FR,0,1,0,1,0,0
10,when a shot is marked as a miss the product shall simulate the sound of a shot missing its target,FR,1,1,0,0,1,0
10,once a game has been initiated the product shall make the players assigned to the game unavailable for selection from the list of players,FR,1,0,1,0,0,0
8,all registered customer information shall be stored and maintained in the database even after the customer cancels their account,FR,1,0,1,0,0,0
10,once a game is initiated the product shall allow each player to position their 5 ships on their respective defensive grids,FR,1,0,1,0,0,0
10,the product shall end a game when a hit by the offensive player results in sinking the last of the defensive player s ships which had not been previously marked as sunk,FR,1,0,1,0,0,0
13,the wcs system must run queries to the wcs databases once again on a specified day to update the available data available to ccr users queries must be made to external databases for data refresh once a week,FR,1,1,0,0,1,0
8,movies shall be encoded for 56k and 256k streams,FR,0,1,0,1,0,0
5,only adjusters with a supervisor role can update preferred repair facility ratings users without the supervisor role cannot access the repair facility ratings,FR,1,1,0,0,1,0
5,the user shall select to save the preferred repair facility ratings,FR,1,0,1,0,0,0
12,the product shall have security the product shall provide authentication and authorization,FR,0,1,0,1,0,0
8,the website shall continue to operate if the streaming server goes down,FR,0,1,0,1,0,0
10,the product shall allow the player to position ships diagonally on their grid,FR,1,0,1,0,0,0
7,the system shall allow entering storing and modifying product formulas,FR,1,0,1,0,0,0
10,if the shot was marked as a hit the product shall allow the offensive player to define a shot,FR,1,0,1,0,0,0
4,the disputes system shall prevent the creation of duplicate dispute requests 100 of the time,FR,1,1,0,0,1,0
1,the system shall color code events according to their variance from current time,FR,1,1,0,0,1,0
5,the product shall interface with the choiceparts system once per day at approximately 1 00 am,FR,0,1,0,1,0,0
8,the website shall be capable of supporting 100 000 customers,FR,0,1,0,1,0,0
8,all movies shall be streamed on demand at any time of the day,FR,1,1,0,0,1,0
8,the website shall prevent its data from being corrupted when incorrect data is entered in,FR,0,1,0,1,0,0
7,the system shall allow generation of inventory quantity adjustment documents on demand,FR,1,0,1,0,0,0
2,the system shall notify the realtor when a seller or buyer responds to an appointment request,FR,1,0,1,0,0,0
13,the wcs system shall be available at all times as long as ibm s internal intranet w3 is accessible the wcs system will be available 95 of the time ibm s internal intranet w3 is available,FR,0,1,0,1,0,0
8,system shall let customers register on the website as a unlimited movie subscriber user in under 10 minutes,FR,1,1,0,0,1,0
11,on a 112k connection or faster the system response time for all operations must be no more than 3 seconds 90 of the time,FR,0,1,0,1,0,0
13,the system interface will use ccr nomenclature the system must use the same nomenclature used in the existing wcs system and reports,FR,0,1,0,1,0,0
9,if the leads score falls within the medium average then it will be set for manual verification by an enrollment coordinator through the eleads system,FR,1,0,1,0,0,0
2,the user shall be able to download appointments and contact information for clients,FR,1,0,1,0,0,0
4,all screens created as part of the disputes application must comply with corporate standards for interface creation,FR,0,1,0,1,0,0
6,the product will require collaboration with a database management system dbms the dbms may be located on the same machine as the product or on a separate machine residing on the same computer network,FR,0,1,0,1,0,0
14,each team owner will need to use a username and password in order to be authenticated to reach the team owner s page,FR,0,1,0,1,0,0
10,the notification of the game ending will include the reason the game is ended i e a player has won the game or a player has ended the game,FR,1,0,1,0,0,0
3,program administrators nursing staff members shall have the ability to modify information relating to a clinical site including the clinical site name site contact person contact information and address,FR,1,0,1,0,0,0
13,a user shall be able to use the system without instruction after a short amount of time after one use a user should understand and remember 90 of the system usage and navigation,FR,0,1,0,1,0,0
5,the vehicle location shall include street address city state and zipcode,FR,0,0,0,0,0,1
15,changes to revenue and expense formulae must be applied to the rfs system every year prior to the budgeting process start revenue and expense formulae will be updated within one week of their receipt after which 2 weeks will be allotted to testing of the budget calculations to be conducted jointly by the project development team and pcg finance,FR,0,1,0,1,0,0
8,all streaming movie sales will be logged in the database and accessible by the administrator,FR,1,1,0,0,1,0
10,the product shall prevent the player from overlapping ships on their grid,FR,1,0,1,0,0,0
2,the system shall display clear property images in the search results,FR,1,0,1,0,0,0
6,the product shall have the ability to send meeting reminders to employees,FR,1,0,1,0,0,0
8,the owner shall have free access to all of the streaming movies,FR,0,1,0,1,0,0
3,the system shall be able to display a printable summary for individual clinical sites which will include information on labs being held at that site for the given quarter clinical site general information on labs held at that location dates and times of all labs held there,FR,1,0,1,0,0,0
5,the product shall comply with corporate user interface guidelines,FR,0,1,0,1,0,0
8,the product shall use symbols and words that are naturally understandable by users familiar with websites,FR,0,1,0,1,0,0
10,the product shall allow a player to position ships horizontally on their grid,FR,1,0,1,0,0,0
6,the product shall update existing conference rooms,FR,1,0,1,0,0,0
4,the disputes system must prevent users from accessing any dispute cases that do not belong to their cardholder base,FR,0,1,0,1,0,0
8,users should only have to navigate through a maximum of 4 pages to create an account with the website,FR,0,1,0,1,0,0
10,the product shall provide players no access to information that might reveal the identity of another player,FR,0,1,0,1,0,0
8,website shall allow customers to add their own movie review for a selected movie,FR,1,0,1,0,0,0
10,when a game is ended the product shall allow each player to identify himself or herself as an available player in the list of players,FR,1,0,1,0,0,0
12,the product shall continue to operate during upgrade change or new resource addition the product shall be able to continue to operate with no interruption in service due to new resource additions,FR,0,1,0,1,0,0
3,program administrators and nursing staff members shall have the ability to specify which classes are required for a program of study,FR,1,0,1,0,0,0
8,izogn administrator must be able to add new products to the website within 2 minutes,FR,1,1,0,0,1,0
8,system shall let the administrator add remove categories on the website in under 5 minutes,FR,1,1,0,0,1,0
9,the leads washing functionality will insert all leads captured by the web service,FR,1,0,1,0,0,0
7,pme subsystem shall allow building product menus based on the list of products kept in the accounting system,FR,1,0,1,0,0,0
13,the system shall use ibm and ccr branding standards the interface must have one ibm logo and one ccr logo,FR,0,1,0,1,0,0
14,the application shall be able to complete every user transaction within one fourth of a second of receiving the request over the network,FR,0,1,0,1,0,0
5,the audit report shall include the number of available recycled parts from the original search results,FR,1,0,1,0,0,0
3,the system shall be easy to use by the program administrators nursing staff members,FR,0,1,0,1,0,0
6,the product will be available for licensing as a one server two five servers or five or more servers license,FR,0,1,0,1,0,0
7,recreation of inventory quantity adjustment for the period of previous 30 days shall take no more than 30min,FR,1,1,0,0,1,0
3,the system shall be able to display a printable summary for individual clinical labs which will include but not be limited to class name class number lab section listing of students enrolled instructor day s time and location,FR,1,0,1,0,0,0
14,the message board shall contain the 5 most recently posted messages on the league page the messages will contain up to the first 150 characters of the message,FR,1,0,1,0,0,0
12,the product shall be updated on a regular basis the product will have a new major feature introduced every six months and quarterly maintenance releases every six months,FR,0,1,0,1,0,0
3,the response time of general student management tasks shall take no longer than 5 seconds and the response time of schedule generation shall take no longer than 30 seconds,FR,0,1,0,1,0,0
5,the product shall be able to handle 10 000 concurrent users within 2 years of the initial launch,FR,0,1,0,1,0,0
1,the system shall allow a user to define the time segments,FR,1,0,1,0,0,0
4,any disputes cases that have been closed for over 6 months must be purged from the online disputes database,FR,1,0,1,0,0,0
1,the system shall have a mdi form that allows for the viewing of the graph and the data table,FR,1,0,1,0,0,0
10,when a game is ended the product shall notify the players that the game is ended,FR,1,0,1,0,0,0
6,the product shall use a standard navigation menu familiar to most web users,FR,0,1,0,1,0,0
10,when the hit results in sinking a ship the product shall indicate the type of ship sunk on the defensive grid of the defensive player,FR,1,0,1,0,0,0
2,the product shall have a consistent color scheme and fonts,FR,0,1,0,1,0,0
3,program administrators nursing staff members shall be able to create a new program of study,FR,1,0,1,0,0,0
2,out of 1000 accesses to the system the system is available 999 times,FR,0,1,0,1,0,0
3,2 out of 3 program administrators nursing staff members shall successfully be able to use the system to manage the scheduling of classes and clinicals,FR,1,1,0,0,1,0
12,the product shall operate with every platform the product shall accommodate any new technology without any change in its architecture,FR,0,1,0,1,0,0
2,the realtor shall be able to retrieve a map showing property locations for a specified area,FR,1,0,1,0,0,0
5,the adjuster shall request a recycled parts audit of the collision estimate,FR,1,0,1,0,0,0
4,the list of dispute cases that are displayed after a search is performed must be color coded for easy identification of dispute cases based upon the dispute case status,FR,0,1,0,1,0,0
8,viewing a movie details the website will display the movies description actor and director entered in by the administrator,FR,1,0,1,0,0,0
11,the system must be available for use between 7 00am and 11 59pm all days of the year,FR,0,1,0,1,0,0
2,the product shall be available for use 24 hours per day 365 days per year,FR,0,1,0,1,0,0
3,we must be able to interface with any html browser,FR,0,1,0,1,0,0
12,the product shall be able to process all transactions the product shall process minimum of 1 million transactions per year,FR,0,1,0,1,0,0
10,the product shall allow the player to position ships vertically on their grid,FR,1,0,1,0,0,0
5,the recycled parts search results provided to the estimator shall be retrieved by the system,FR,1,0,1,0,0,0
6,the product must make use of web application server technology open source examples include apache web server tomcat and the jboss application server,FR,0,1,0,1,0,0
8,system shall allow users to update their billing and contact information via the my account section of the website,FR,1,0,1,0,0,0
6,the product shall allow the user to select a chosen language from one of the target market countries,FR,1,1,0,0,1,0
1,the system shall display events or activities,FR,1,0,1,0,0,0
6,the product shall allow for customization of start page and views preferences,FR,0,1,0,1,0,0
12,the product shall process messages within 2 seconds the product shall have a maximum message processing time of 2 seconds,FR,1,1,0,0,1,0
3,program administrators and nursing staff members shall be able to add new classes to a sequence of classes,FR,1,0,1,0,0,0
3,a clinical lab section shall include the clinical site name the class instructor day and time of the lab,FR,0,0,0,0,0,1
1,the system shall filter data by venues and key events,FR,1,0,1,0,0,0
3,program administrators nursing staff members shall have the ability to modify information relating to a program of study within the nursing department including the program of study name and required classes for that program of study,FR,1,0,1,0,0,0
5,the audit report shall be displayed to the user,FR,1,0,1,0,0,0
10,once a game is initiated the product shall display a defensive grid to each player,FR,1,0,1,0,0,0
5,the search radius shall be between 1 and 30 miles,FR,0,0,0,0,0,1
2,the product shall be able to support multiple remote users,FR,1,0,1,0,0,0
2,the product shall be capable of handling the existing 1000 users this number is expected to grow 5 times within the next year,FR,0,1,0,1,0,0
1,the display shall have two regions left 2 3 of the display is graphical right 1 3 of the display is a data table,FR,0,1,0,1,0,0
15,the rfs system should be able to easily interface with the bdw environment in order to load the data 7 data files shall be received from the bdw and loaded into the rfs system within 3 hours one day prior to the start of budgeting process every year the data will be as of october month end test files 7 shall be loaded up to 5 times throughout the year from the bdw,FR,0,1,0,1,0,0
3,the system shall able to operate within a business office environment typical of the nursing department at depaul university,FR,0,1,0,1,0,0
14,the application shall run on a web application server,FR,0,1,0,1,0,0
8,the system shall notify customers of changes to its information policy,FR,1,0,1,0,0,0
12,the product shall be robust with fault tolerance the product shall have fault tolerance by using recovery technique compensatory transaction and routing around failures,FR,0,1,0,1,0,0
13,rreports must be easy to generate eports must be generated within one button click and exported within one button click after selecting the report,FR,0,1,0,1,0,0
6,the product shall record different meeting types,FR,1,0,1,0,0,0
3,program administrators and nursing staff members shall be able to add a student who has registered for a clinical class to a clinical lab section for that class,FR,1,0,1,0,0,0
6,the product shall store new conference rooms,FR,1,0,1,0,0,0
6,the product shall record meeting entries,FR,1,0,1,0,0,0
8,the website shall make its user aware of its information practices before collection data from them via a privacy policy accessible on all pages of the website,FR,1,1,0,0,1,0
10,the product shall maintain the status of each player for a turn either offensive or defensive,FR,1,0,1,0,0,0
