ProjectID,RequirementText,Class,IsFunctional,IsQuality,IsOnlyFunctional,IsOnlyQuality,F+Q,NotR
11,the product shall ensure that only supervisors can enter a caller s schedule the product must ensure that supervisors are allowed to access advertise empty time slots,FR,1,1,0,0,1,0
6,the product shall be able to delete room equipment,FR,1,0,1,0,0,0
10,when a shot is marked as a hit the product shall simulate the sound of a shot hitting its target,FR,1,1,0,0,1,0
4,all actions that modify an existing dispute case must be recorded in the case history,FR,1,1,0,0,1,0
2,only registered realtors shall be able to access the system,FR,0,1,0,1,0,0
7,the system shall be able to automatically backup business data and restore them on demand,FR,1,1,0,0,1,0
8,only administrators can activate a pre paid card,FR,0,1,0,1,0,0
6,the product shall make the users want to use it 80 of the users surveyed report they are regularly using the product after the first 2 weeks post launch,FR,0,1,0,1,0,0
12,the product shall provide error tracking services the product shall help the system administrators and dbas to resolve transaction errors 99 of the time,FR,1,1,0,0,1,0
8,the website will comply with w3c standards,FR,0,1,0,1,0,0
5,the system shall prevent malicious attacks including denial of service,FR,0,1,0,1,0,0
6,the product shall record the transportation status of equipment reserved,FR,1,0,1,0,0,0
3,staff members shall be able to complete a set of tasks in a timely manner,FR,0,1,0,1,0,0
4,100 of merchant services representatives shall be able to successfully perform a follow up action on a dispute case on the first encounter after completing the training course,FR,0,1,0,1,0,0
5,the ratings shall be from a scale of 1 10,FR,1,0,1,0,0,0
9,for leads that process longer than 25 seconds the system will record the event and duration,FR,1,0,1,0,0,0
8,movies shall be encoded and streamed via windows media player 9 0,FR,0,1,0,1,0,0
14,the application shall ask the user to confirm dropping a player or trading a player before performing the action,FR,1,0,1,0,0,0
6,the product shall create an exception log of problems encountered within the product for transmission to our company for analysis and resolution,FR,1,1,0,0,1,0
4,the disputes application shall ensure that only users with the appropriate access level are allowed to initiate dispute requests,FR,0,1,0,1,0,0
8,all aspects of the website shall be accessed by a web browser over the internet,FR,0,1,0,1,0,0
5,the product shall adhere to the corporate architecture guidelines,FR,0,1,0,1,0,0
1,the system shall refresh the display every 60 seconds,FR,1,1,0,0,1,0
6,the product shall prevent the input of malicious data the product and or adjacent hardware software systems data shall remain 100 uncorrupted each time malicious data is input into the product,FR,0,1,0,1,0,0
8,the website will provide a help section with answers and solutions to common problems,FR,1,0,1,0,0,0
3,the system shall allow a program administrator or nursing staff member to remove a student from a clinical lab section,FR,1,0,1,0,0,0
4,the disputes system shall allow the user to create or initiate a chargeback request the system must prompt the user to enter the required information to initiate a chargeback request the chargeback request results in a printed chargeback notification that is sent to merchant indicating that their account will be charged back if no proof is provided that the disputed transaction is valid,FR,1,0,1,0,0,0
6,the product and or dependent databases filesystems shall remain operational as a result of the input of malicious data the product and or dependent databases filesystems shall not crash 100 of the time that malicious data is input into the product,FR,0,1,0,1,0,0
5,the maintenance of the product will fall within the established corporate maintenance windows,FR,0,1,0,1,0,0
7,product formulas shall allow use of semi products which have own formulas,FR,1,0,1,0,0,0
8,website shall allow customers to view reviews of selected movies by other customers,FR,1,0,1,0,0,0
3,the system shall interface with the faculty central server,FR,0,1,0,1,0,0
2,the product shall operate in offline mode whenever internet connection is unavailable,FR,0,1,0,1,0,0
5,the recycled parts audit report shall be returned to the user within 10 seconds the audit report shall be returned within 10 seconds,FR,1,1,0,0,1,0
4,the disputes system must prevent external users from requesting original receipts requests for original receipts are restricted to internal users,FR,1,0,1,0,0,0
5,the adjuster shall be able to override the preferred repair facitlity on the estimate assignment,FR,1,0,1,0,0,0
4,all updates to data files or database must be initiated from the disputes system,FR,0,0,0,0,0,1
8,system shall let izogn manager access sales and usage statistics in under 2 minutes,FR,0,1,0,1,0,0
7,the system shall utilize currently owned computer equipment,FR,0,1,0,1,0,0
8,website shall allow customers to browse movies by categories entered in by izogn administrator,FR,1,0,1,0,0,0
5,the estimator shall search for available recycled parts using damaged vehicle parts information,FR,1,0,1,0,0,0
9,the lead washing process will operate within the established physical web service structure,FR,0,1,0,1,0,0
9,the leads washing functionality will have an interface in which lead data parameters can be maintained,FR,1,0,1,0,0,0
3,program administrators and nursing staff members shall be able to add a single student to a cohort,FR,1,0,1,0,0,0
6,the product shall be able to process 10 000 transactions per hour within two years of its launch this number will increase to 20 000 by release 2,FR,0,1,0,1,0,0
5,the product shall be supported using the corporate support center,FR,0,1,0,1,0,0
6,the product shall have the ability to receive automatic software updates as new threats emerge 100 of customers will be able to receive automatic software updates transmitted to the installed product,FR,0,1,0,1,0,0
13,the wcs system shall not allow automatic logins by any user cookies containing wcs login information about a user will not be stored on a user s computer,FR,0,1,0,1,0,0
3,the system shall be able to display a printable summary of the system log,FR,1,0,1,0,0,0
3,the system shall be used within the specifications defined by the computers used by the program administrators nursing staff members,FR,0,1,0,1,0,0
2,the look and feel of the system shall conform to the user interface standards of the smart device,FR,0,1,0,1,0,0
10,for each turn the product shall allow the offensive player to define a shot,FR,1,0,1,0,0,0
5,the estimator shall not apply recycled parts to the collision estimate if no available parts are returned,FR,1,0,1,0,0,0
8,an anonymous survey will show that 70 of customers are comfortable purchasing streaming movies after 2 weeks using the website,FR,0,1,0,1,0,0
5,the product shall be easy to use by adjusters and collision estimators 95 of adjusters and collision estimators shall find the product easy to use,FR,0,1,0,1,0,0
5,the product must comply with sarbanes oxley,FR,0,1,0,1,0,0
1,the bottom 3 4 of the table will hold events that occur according to its relevance to current time,FR,1,1,0,0,1,0
15,user access should be limited to the permissions granted to their role s each level in the pcg hierarchy will be assigned a role and users will be assigned to these roles access to functionality within rfs system is dependent on the privileges permission assigned to the role,FR,0,1,0,1,0,0
6,the language of the product shall accommodate all of the target market countries 90 of survey respondents from each target market country will find that the language of the product is acceptable,FR,0,1,0,1,0,0
4,the disputes application shall interface with the cardmember information database the cardmember information database provides detailed information with regard to a cardmember all cardmember detail information must be obtained from the cardmember information database,FR,0,1,0,1,0,0
6,the product s look and feel shall be able to incorporate aspects of the customer s organization such as logo branding and identity,FR,0,1,0,1,0,0
6,the product shall have a customizable look and feel,FR,1,1,0,0,1,0
6,the product shall display conference rooms according to search parameters,FR,1,0,1,0,0,0
5,the audit report shall include the percentage of available recycled parts used in the estimate,FR,1,0,1,0,0,0
8,system shall let administrators generate unique pre paid pins in under 2 minutes and generate an excel file with the generated pins,FR,1,1,0,0,1,0
6,the product is expected to integrate with multiple database management systems the product will operate with oracle sql server db2 mysql hsql and ms access,FR,0,1,0,1,0,0
6,a new user must be able to be added to the system within 10 minutes 90 of new users are able to log into the system within 10 minutes,FR,0,1,0,1,0,0
4,the disputes system must provide the ability to view existing dispute cases,FR,1,0,1,0,0,0
4,the disputes application must conform to the legal requirements as specified by regulation e and regulation z that govern credit card disputes processing,FR,0,1,0,1,0,0
4,the disputes system will provide the user the ability to create or initiate a ticket retrieval request as part of ticket retrieval creation process the system must prompt the user to enter all the required information to create the ticket retrieval request the ticket retrieval request is a document that is sent to merchant inquiring the validity of a transaction,FR,1,0,1,0,0,0
6,the product shall conform to the americans with disabilities act,FR,0,1,0,1,0,0
3,students added to a cohort shall be eligible for the cohort s program of study,FR,1,0,1,0,0,0
13,all ccr users shall receive training before the wcs system is deployed one training session will be held for 100 of ccr users before system deployment based on a ccr user being available,FR,0,0,0,0,0,1
2,the product shall retain user preferences in the event of a failure,FR,1,0,1,0,0,0
10,when a ship is sunk the product shall simulate the sound of a sinking ship,FR,1,1,0,0,1,0
4,the dispute system shall provide the users with the ability to follow up on a dispute case via follow up actions the list of available follow up actions for a given dispute case must be filtered by the status of the case and the access level of the user,FR,1,0,1,0,0,0
8,the same hardware supporting the current website will be used to support the new system,FR,0,1,0,1,0,0
6,the product shall record updated meeting agendas,FR,1,0,1,0,0,0
5,the system shall generate an audit report based on the available recycled parts and the collision estimate,FR,1,0,1,0,0,0
6,the response shall be fast enough to avoid interrupting the user s flow of thought 90 of tasks shall complete within 5 seconds 98 of tasks shall complete within 8 seconds,FR,0,1,0,1,0,0
13,the system shall only be accessed by authorized corporate community grants ccr employees users must be authenticated using their ibm intranet user name and password,FR,0,1,0,1,0,0
9,the leads washing functionality will verify the users authentication and rights to make parameter updates,FR,1,0,1,0,0,0
12,the product shall interface csr and datastream the product shall exchange messages between csr and eam on a real time basis without any direct interfaces between two systems,FR,0,1,0,1,0,0
15,the users should be able to easily use the system to successfully complete their budgets within the stipulated time for completion with a week of training prior to product implementation 98 of the users shall complete their budgets within the stipulated time,FR,0,1,0,1,0,0
1,the system shall offer the ability to pause and resume the refresh of data,FR,1,0,1,0,0,0
5,the user shall select to view the preferred repair facility ratings,FR,1,0,1,0,0,0
3,the system will notify affected parties when changes occur affecting specific students including but not limited to changing a student s status from full time to part time and moving a student to a different clinical section,FR,1,0,1,0,0,0
3,the system will use the stored e mail addresses as a primary means of communicating information to affected parties,FR,1,0,1,0,0,0
4,all authorized users once authenticated must be able to logon to the disputes system,FR,0,1,0,1,0,0
5,the preferred repair facility shall be returned to the user,FR,1,0,1,0,0,0
8,the website shall protect itself from intentional abuse and notify the administrator at all occurrences,FR,0,1,0,1,0,0
14,a new user shall be able to navigate through the league and team pages within 30 seconds of reaching the start up page,FR,0,1,0,1,0,0
10,the product shall allow a player to end a game at any time during the game,FR,1,0,1,0,0,0
10,the product shall be available 24 hours per day seven days per week,FR,0,1,0,1,0,0
5,the adjuster shall review the collision estimate,FR,1,0,1,0,0,0
10,if the shot was marked as a miss the product shall change the status of the offensive player to defensive,FR,1,0,1,0,0,0
5,the system shall locate the preferred repair facility with the highest ratings for the input criteria,FR,1,0,1,0,0,0
5,the audit report shall include the total score of the audit which sums the indivual line items,FR,1,0,1,0,0,0
6,the product shall be available for distribution as a packaged cd,FR,0,1,0,1,0,0
8,velkat staff will be available for phone support between 7am 7pm m f to provide technical support to the izogn administrators,FR,0,1,0,1,0,0
6,the product shall be easy to use 90 of users will be able to successfully reserve a conference room within 5 minutes of product use,FR,0,1,0,1,0,0
3,the system shall be able to display a report of needed classes for a given quarter for all cohorts of all programs for program administrators nursing staff members planning purposes,FR,1,0,1,0,0,0
3,dr susan poslusny and dr julie donalek are the only people who shall have access to students personal information,FR,0,1,0,1,0,0
6,the product will update existing room equipment,FR,1,0,1,0,0,0
10,the product shall protect the identity of the players the product shall provide players no access to information that might reveal the identity of another player,FR,0,1,0,1,0,0
2,the product shall produce search results in an acceptable time,FR,1,1,0,0,1,0
1,the product shall ensure that it can only be accessed by authorized users the product will be able to distinguish between authorized and unauthorized users in all access attempts,FR,1,1,0,0,1,0
2,the product is expected to run on windows ce and palm operating systems,FR,0,1,0,1,0,0
5,the product shall adhere to the corporate online availability schedule the application is brought down only within 98 of the scheduled outages per the availability schedule,FR,0,1,0,1,0,0
4,only the system administrator shall be able to reset a revoked user logon account,FR,0,1,0,1,0,0
1,the product shall be intuitive and self explanatory 90 of new users shall be able to start the display of events or activities within 90 minutes of using the product,FR,0,1,0,1,0,0
10,when the hit results in sinking a ship the product shall notify the players that the ship was sunk,FR,1,0,1,0,0,0
8,any interface between a user and the automated system shall have a maximum response time of 5 seconds unless noted by an exception below,FR,0,1,0,1,0,0
6,the product shall notify building personnel of equipment transport requests,FR,1,0,1,0,0,0
3,program administrators and nursing staff members shall be able to add clinical classes or sections to a sequence of classes,FR,1,0,1,0,0,0
2,the system shall have a professional appearance,FR,0,1,0,1,0,0
2,the product shall allow the user to save the property search results,FR,1,0,1,0,0,0
4,the disputes application shall interface with the statement database the statement database provides the transaction details to the disputes system all transaction details must be obtained from the statement database,FR,0,1,0,1,0,0
3,the system shall be available for use between the hours of 8am and 6pm,FR,0,1,0,1,0,0
8,customer shall be able to check the status of their prepaid card by entering in the pin number in under 5 seconds,FR,1,1,0,0,1,0
1,the system shall display events in a vertical table by time,FR,1,0,1,0,0,0
3,a program administrator nursing staff member shall be able to add a new nursing student to the system,FR,1,0,1,0,0,0
14,users shall be able to reach the add drop and trade player pages with one click from the team owner s page,FR,0,1,0,1,0,0
10,for each shot the product shall notify the players whether the shot was a hit or miss,FR,1,0,1,0,0,0
15,the product must comply with the intranet page standards and requirements of enet securities 95 of the product look feel will be approved by the architecture group prior to implementation the remaining 5 will be corrected and approved within one month of product release,FR,0,1,0,1,0,0
5,one insurance company shall not be able to view another insurance companys claim data,FR,0,1,0,1,0,0
5,the audit report shall include the total number of recycled parts used in the estimate,FR,1,0,1,0,0,0
10,for each shot the product shall mark the shot as a hit or miss on the defensive grid of the defensive player,FR,1,0,1,0,0,0
15,the product interface should be fast the response time of the product interface should not exceed 2 seconds 90 of the time for 10 of the time the response time should not be more than 10 seconds not be more than 10 seconds,FR,0,1,0,1,0,0
3,the system shall have basic data integrity checking to reduce the possibility of incorrect or invalid data being introduced,FR,1,1,0,0,1,0
9,prior to submitting the lead to the enterprise system the leads washing functionality will assign the lead to an admissions rep,FR,1,0,1,0,0,0
8,website shall allow the izogn administrator to approve a review posted by a customer,FR,1,0,1,0,0,0
3,clinical site information shall include but not be limited to the name of the site contact person and contact information,FR,0,0,0,0,0,1
8,the website shall continue to operate if the payment gateway goes down,FR,0,1,0,1,0,0
8,the website should appeal to all africans not only nigerians,FR,0,1,0,1,0,0
5,the system shall retain the available recycled parts and suppliers returned from the search,FR,1,0,1,0,0,0
3,a clinical class shall specify the course name lecture room requirements clinical site needs lecture instructor needs and clinical lab instructor needs,FR,0,0,0,0,0,1
4,the disputes system shall accurately provide a list of possible reason codes for a given transaction the list of possible reason codes must be derived based on the type of transaction and the industry that the merchant belongs to according to the business rules defined for the disputes system,FR,1,1,0,0,1,0
8,the product shall be able to be installed in the specified environment within 1 working day,FR,0,1,0,1,0,0
4,the disputes system will facilitate direct data entry of a dispute case via a user interface that supports real time responses to the users,FR,0,1,0,1,0,0
7,the system shall granularly control access rights to all major subsystems it should be possible to assign access rights to all subsystems independently,FR,0,1,0,1,0,0
13,the brio portion of the wcs system must be able to export files in spreadsheet form microsoft excel and lotus 1 2 3 formats brio will provide buttons in the user interface that produce export reports in xls or 123 file formats,FR,1,1,0,0,1,0
5,the user shall enter new ratings based on the audit report,FR,1,0,1,0,0,0
6,the product shall allow for intuitive searching of available conference rooms,FR,1,1,0,0,1,0
10,the product shall be intuitive and self explanatory nine out ten users shall be able to successfully complete a game with no training,FR,0,1,0,1,0,0
6,each time a conference room is reserved the conference room schedule shall be updated to reflect the time and date of the reservation,FR,1,0,1,0,0,0
3,all of the users shall be able to use the system after one day of training,FR,0,1,0,1,0,0
8,the website design should be modern clean and concise,FR,0,1,0,1,0,0
9,washing parameters will be updated during scheduled maintenance hours,FR,0,1,0,1,0,0
4,100 of the cardmember and merchant services representatives shall use the disputes application regularly after a 2 day training course,FR,0,1,0,1,0,0
11,the product shall ensure that only supervisors can advertise empty time slots the product must ensure that supervisors are allowed to access advertise empty time slots,FR,1,1,0,0,1,0
5,the product shall be able to handle up to 1500 simultaneous users the system shall perform with 1500 users as a time,FR,0,1,0,1,0,0
12,the product shall provide monitoring services the product shall be easy for system administrators and dbas to use after two weeks of usage,FR,1,1,0,0,1,0
1,the system shall display data from the sync matrix 1 0 and exercise management tool 1 0 applications,FR,1,1,0,0,1,0
3,for each class within a sequence for a cohort program administrators and nursing staff members shall be able to specify which quarter that class will be offered,FR,1,0,1,0,0,0
8,the website will use standard internet conventions when interacting with the user,FR,0,1,0,1,0,0
8,all customer information will be stored on a secure database accessible only to authorized personnel,FR,0,1,0,1,0,0
3,the system shall interface with the student master server,FR,0,1,0,1,0,0
15,98 of the user workstations shall meet the minimum software requirements prior to implementation microsoft internet explorer 5 0 microsoft net framework 1 1 microsoft internet explorer web controls,FR,0,1,0,1,0,0
12,the product shall provide dynamic change support and transparent resource addition the product shall support transparent resource addition and dynamic change support to provide scalability and avoid service interruptions of more than 1 day,FR,1,1,0,0,1,0
3,the system shall contain contact information e mail and phone number for all people relevant to the system including but not limited to staff members students lecture instructors clinical lab instructors and clinical site administrators,FR,1,0,1,0,0,0
10,the product shall allow a player to initiate a game by selecting another available player from the list of players,FR,1,0,1,0,0,0
1,the system shall provide charts for the activity or event actual versus assumed time,FR,1,0,1,0,0,0
6,the product shall ensure that only company employees or external users with company approved user ids may have product access 100 of all logons shall be by either company employees or external users with company approved user ids,FR,0,1,0,1,0,0
14,a secondary database will be used to store historical statistics and data,FR,0,1,0,1,0,0
8,administrator shall be able to activate a pre paid card via the administration section in under 5 seconds,FR,1,1,0,0,1,0
10,when the hit results in sinking a ship the product shall mark the ship as sunk on the offensive grid of the offensive player,FR,1,0,1,0,0,0
10,the response time shall be fast enough to maintain the flow of the game the response time shall be no more than 2 seconds for 95 of responses and no more than 4 for the remaining responses,FR,0,1,0,1,0,0
8,data integrity scripts will be run on a weekly basis to verify the integrity of the database,FR,0,1,0,1,0,0
4,the disputes application shall manipulate and view business data users will not have direct access to data files or databases,FR,1,1,0,0,1,0
7,the system shall not require additional third party licenses resulting in royalty fees,FR,0,1,0,1,0,0
5,the product must support mozilla firefox 1 0 and above,FR,0,1,0,1,0,0
7,the iqa subsystem shall take into account current inventory status and adjust inventory of substitutionary ingredients accordingly,FR,1,0,1,0,0,0
9,defect reports will be available to technical units on a 24x7 basis,FR,0,1,0,1,0,0
9,if the leads score falls within the high average score then it will be process by the ara functionality,FR,1,0,1,0,0,0
4,if a user account is revoked it can only be re instantiated by the system administrator,FR,0,1,0,1,0,0
9,the leads washing functionality will store any potential lead duplicates returned by the enterprise system,FR,1,0,1,0,0,0
14,each page shall contain a navigation menu which shows the index into which the current page is contained,FR,0,1,0,1,0,0
6,the product shall allow an organizer to invite other employees to meetings,FR,1,0,1,0,0,0
9,the leads washing functionality will validate all leads received by the web service for valid data,FR,1,0,1,0,0,0
8,website must be fully operational with msn tv2,FR,0,1,0,1,0,0
14,each page shall contain a similar format with action items in one location and navigation buttons in a different location,FR,0,1,0,1,0,0
3,the system shall be expected to manage the nursing program curriculum and class clinical scheduling for a minimum of 5 years,FR,1,1,0,0,1,0
7,the system shall maintain consistent security any changes in user passwords and or permissions should take affect in all parts of the system,FR,0,1,0,1,0,0
8,system shall let administrator add remove movies on the website in under 5 minutes entered movie information will be stored in the database and will now be available on the website,FR,1,1,0,0,1,0
9,the leads washing functionality will compile both contact and academic scoring information for a total score,FR,1,0,1,0,0,0
5,the product shall comply with insurance regulations regarding claims processing,FR,0,1,0,1,0,0
12,the product shall be platform independent the product shall enable access to any type of development environment and platform,FR,0,1,0,1,0,0
5,the product shall increase productivity of collision estimators 80 of the collision estimators shall agree their productivity has increase within 1 month of using the product,FR,0,1,0,1,0,0
3,the report of needed classes shall include but not be limited to classes to be offered number of sections needed number of labs needed and room types needed,FR,1,0,1,0,0,0
5,the product shall free of computer viruses,FR,0,1,0,1,0,0
