ProjectID,RequirementText,Class,IsFunctional,IsQuality,IsOnlyFunctional,IsOnlyQuality,F+Q,NotR
3,the system shall be able to display a printable summary for individual cohorts which will include the students enlisted the program of study sequence of classes cohort progress through the program and timeline of completion,FR,1,0,1,0,0,0
11,the system shall have high availability every day of the year the system must be available for use between 12 00am and 6 00pm all days of the year,FR,0,1,0,1,0,0
6,the product must be able to interface with any html browser the product shall transmit data between the user and the product without problems the product shall display html properly in 80 of all html browsers tested minimum is to test 8 browsers,FR,0,1,0,1,0,0
4,the disputes system must allow the users to select disputable transactions based on the age of the transaction from a user interface and initiate a dispute ticket retrieval request or chargeback notification on the selected transaction,FR,1,0,1,0,0,0
6,the product will display an available status for unreserved conference rooms,FR,1,0,1,0,0,0
8,the website should cater to all tribes in nigeria,FR,0,1,0,1,0,0
5,the appearance of the product shall appear professional,FR,0,1,0,1,0,0
15,new branches complexes districts regions and revenue expense accounts added to the bdw must be reflected in the rfs system 100 of the entities mentioned above available as of october month end will be loaded into the rfs system prior to the budget start process,FR,0,1,0,1,0,0
8,shall be able to stream purchased movie via windows media player for up to 2 days aftere purchase date,FR,1,0,1,0,0,0
10,the product shall make inactive players unavailable for selection from the list of players,FR,1,0,1,0,0,0
4,the disputes system shall provide the users the ability to view the history of all activities that have occurred on the dispute case,FR,1,0,1,0,0,0
6,the product will notify employees of meeting invitations,FR,1,0,1,0,0,0
3,program administrators nursing staff members shall have the ability to modify information relating to a nursing student including student id student name phone number e mail status full time or part time and program of study,FR,1,0,1,0,0,0
5,the product must support internet explorer 5 5 and above,FR,0,1,0,1,0,0
5,the product shall comply with the estimatics laws relating to recycled parts usage,FR,0,1,0,1,0,0
2,the cma report shall be returned no later 60 seconds after the user has entered the cma report criteria,FR,1,1,0,0,1,0
11,the product shall be internet browser independent the product must run using internet explorer and netscape navigator,FR,0,1,0,1,0,0
8,system shall let existing customers log into the website with their email address and password in under 5 seconds,FR,1,1,0,0,1,0
8,the streaming server will support a maximum of 700 movies new servers can be added to support more movies,FR,0,1,0,1,0,0
6,the product must be developed with the j2se j2ee programming language libraries,FR,0,1,0,1,0,0
6,the product shall be used in office environments,FR,0,1,0,1,0,0
10,at the start of each turn the product shall notify each player of his or her status,FR,1,0,1,0,0,0
4,the disputes application must conform to the legal requirements as specified by the merchant operating regulations,FR,0,1,0,1,0,0
3,a class shall be either a non clinical class or a clinical class,FR,0,0,0,0,0,1
6,the product shall have an intuitive user interface,FR,0,1,0,1,0,0
8,all credit card information will be secured on the server and only accessible by authorized izogn administrators information will be encrypted in the database,FR,0,1,0,1,0,0
8,izognmovies shall meet the licensing requirements set forth by the appropriate organizations in order to stream african movies,FR,0,1,0,1,0,0
2,the product shall prevent its data from incorrect data being introduced,FR,0,1,0,1,0,0
4,all business rules specified in the disputes system shall be in compliance to the guidelines of regulation e and regulation z,FR,0,1,0,1,0,0
4,a list of all disputes cases that meet the entered search criteria must be provided to the user the list of cases must differentiate the type and or status of the case by color coding the line item in the list for example all open cases will be yellow and all closed cases will be gray,FR,1,1,0,0,1,0
4,100 of cardmember services representatives shall be able to successfully create a dispute case on the first encounter after completing the training course,FR,0,1,0,1,0,0
3,the system shall use the organization s standard virus protection software to help monitor threats to itself,FR,0,1,0,1,0,0
2,every user of the system shall be authenticated and authorized,FR,1,1,0,0,1,0
7,the system shall allow on demand generation of all inventory quantity adjustment documents since certain point of time,FR,1,0,1,0,0,0
8,all credit card information will be encrypted in the database,FR,0,1,0,1,0,0
2,the product shall use symbols and words that are naturally understandable by the realtor community,FR,0,1,0,1,0,0
3,program administrators nursing staff members shall have the ability to modify information relating to cohorts including cohort identifier program of study preferred sequence of classes and quarters that a cohort will be taking specific classes,FR,1,0,1,0,0,0
3,fit criterion dr susan poslusny and karen sysol are the only people who shall have access to the final class section scheduling for the system that interfaces with campusconnect,FR,0,1,0,1,0,0
13,all changes updates and additions to the wcs system shall be updated in the wcs developer and wcs user guides every change must be reflected in wcs system documentation,FR,0,1,0,1,0,0
4,the disputes system must provide search functionality the search method must include the ability to search by 1 the dispute case number 2 the merchant account number 3 the cardmember account number and 4 the issuer number in addition to the above criteria the search functionality must further allow the user to limit the results of the search by a date range the type of dispute ticket retrieval request or chargeback notification the case status open closed or all and the dispute reason code,FR,1,0,1,0,0,0
1,if projected the data must be readable on a 10x10 projection screen 90 of viewers must be able to read event activity data from a viewing distance of 30,FR,0,1,0,1,0,0
6,the product shall be able to display calendar dates and times according to the user s locale 90 of survey respondents from each target market country will find that the date and time formatting of the product is correct,FR,1,1,0,0,1,0
5,the estimator shall search by zipcode with a radius of 30 miles if no parts are found for the preferred parts suppliers,FR,1,0,1,0,0,0
2,the product shall generate a cma report in an acceptable time,FR,1,1,0,0,1,0
3,the system will notify affected parties when changes occur affecting cohorts including but not limited to changes to the sequence for a cohort s program of study and changes to a given week s schedule lab cancelled this week due to instructor illness,FR,1,0,1,0,0,0
8,a customer can only stream a movie if they purchased it and are within the 2 day viewing period,FR,0,1,0,1,0,0
8,the streaming server will have anti virus software to prevent infection of malicious viruses,FR,0,1,0,1,0,0
8,only authorized personnel can access sales information,FR,0,1,0,1,0,0
7,formula substitutionary ingredients shall be kept in persisted order,FR,1,0,1,0,0,0
12,the product shall comply with city of chicago application development guide framework application development framework will provide structured graphical user interface,FR,0,1,0,1,0,0
10,the product shall maintain a list of players,FR,1,0,1,0,0,0
9,the leads washing functionality will use the parameters supplied by corporate and schools to score part of the lead,FR,1,0,1,0,0,0
14,new system version releases shall be released at the beginning of each nfl season,FR,0,1,0,1,0,0
7,pme subsystem shall allow keeping submenus within menus and products within submenus in a managed and persisted order,FR,0,1,0,1,0,0
1,the product shall respond fast to keep up to date data in the display,FR,0,1,0,1,0,0
7,the system shall meet all applicable accounting standards the final version of the system must successfully pass independent audit performed by a certified auditor,FR,0,1,0,1,0,0
14,application updates shall occur between 3am and 6 am cst on wednesday morning during the middle of the nfl season,FR,0,1,0,1,0,0
8,izogn administrator must be able to update the category listings on the website within 2 minutes,FR,1,1,0,0,1,0
13,the wcs system shall have the ability to connect other designated wcs databases currently not included in the system,FR,0,1,0,1,0,0
8,system shall automatically update the main page of the website every friday and show the 4 latest movies that have been added to the website,FR,1,0,1,0,0,0
5,the user shall easily locate instructions while using the product user help can be found within 90 of the system,FR,0,1,0,1,0,0
4,only users with update access must be able to initiate dispute requests,FR,1,1,0,0,1,0
13,the interface shall be easy to use 90 of users should be able to successfully use the system to generate a report on their first use the interface should adhere to ibm usability standards,FR,0,1,0,1,0,0
10,the product shall simulate the look of ships at sea,FR,0,1,0,1,0,0
1,the top 1 4 of the table will hold events that are to occur sequentially,FR,1,1,0,0,1,0
5,product installations and upgrades shall be handled by the middleware technology team within established launch time frames,FR,0,1,0,1,0,0
3,the system will notify affected parties when changes occur affecting clinicals including but not limited to clinical section capacity changes and clinical section cancellations,FR,1,0,1,0,0,0
13,the wcs system shall have the ability to include data for regions outside the united states and be accessed by users outside of the united states if approved by ccr management,FR,0,1,0,1,0,0
5,the available recycled parts information and their suppliers shall be returned to the user,FR,1,0,1,0,0,0
3,classes for a given cohort shall not conflict with regards to the time and day that they are offered,FR,1,0,1,0,0,0
3,the system shall allow a program administrator nursing staff member to move a student from one clinical lab section to another clinical lab section corresponding to the same clinical class,FR,1,0,1,0,0,0
2,the system shall allow a real estate agent to query mls information,FR,1,0,1,0,0,0
3,a non clinical class shall specify the course name lecture room requirements and instructor needs,FR,0,0,0,0,0,1
9,the process must fit within the processing time conditions set forth by the auto rep assignment process in which a lead is assigned within 3 minutes of the total life cycle,FR,0,1,0,1,0,0
3,the system shall use symbols and words that are naturally understandable by the user community,FR,0,1,0,1,0,0
10,the product shall allow a user to identify himself or herself as a player,FR,1,0,1,0,0,0
5,the preferred repair facility ratings shall be saved within 5 seconds the save shall occur within 5 seconds,FR,1,1,0,0,1,0
3,the system shall be intuitive to the program administrators nursing staff members,FR,0,1,0,1,0,0
6,every registered user will have access to the product s support site via the internet 70 of registered users shall find a solution to their problem within 5 minutes of using the support site,FR,0,1,0,1,0,0
6,the product shall ensure that the database s data corresponds to the data entered by the user each conference room reservation in the system will contain the same information as was entered by the user,FR,0,1,0,1,0,0
3,program administrators and nursing staff members shall be able to add a new cohort to the system identified by start month and year,FR,1,0,1,0,0,0
2,the product shall allow the user to view previously downloaded search results cma reports and appointments,FR,1,0,1,0,0,0
10,once a game is initiated the product shall display an offensive grid to each player,FR,1,0,1,0,0,0
6,the product shall display room equipment according to search parameters,FR,1,0,1,0,0,0
6,the product shall be translated into foreign languages other than the target market countries languages in future releases for each emerging target market it shall take no more than 5 days to configure the product for that market s language,FR,0,1,0,1,0,0
6,aside from server failure the software product shall achieve 99 99 up time,FR,0,1,0,1,0,0
8,website shall request and authorize credit card payment before allowing a user to stream a movie,FR,1,0,1,0,0,0
3,the system will notify affected parties when changes occur affecting classes including but not limited to class cancellations class section detail changes and changes to class offerings for a given quarter,FR,1,0,1,0,0,0
6,the product shall give users feedback when necessary 80 of the users surveyed report that the product accurately confirms their actions,FR,0,1,0,1,0,0
8,the product shall be easy for customers with novice skills on the internet to purchase and watch streaming movies customers should be able to purchase and watch a pre determined movie in under 3 minutes,FR,1,1,0,0,1,0
3,the system shall be capable of processing 100 of nursing students and their classes for the next 10 years,FR,0,1,0,1,0,0
5,the preferred repair facility ratings shall be saved by the system,FR,1,0,1,0,0,0
4,the disputes system shall provide update access capability for authorized users of the application,FR,1,1,0,0,1,0
2,the search results shall be returned no later 30 seconds after the user has entered the search criteria,FR,1,1,0,0,1,0
12,the product shall information security the product shall enable privacy by encryption ws security and integrity checking,FR,0,1,0,1,0,0
5,only collision estimators shall search for recycled parts users without the collision estimator role shall not have access to the search for recycled parts,FR,1,1,0,0,1,0
8,the php code will comply with pear standards,FR,0,1,0,1,0,0
10,when the hit results in sinking a ship the product shall mark the ship as sunk on the defensive grid of the defensive player,FR,1,0,1,0,0,0
6,the product shall be expected to operate for at least 5 years for each customer installation,FR,0,1,0,1,0,0
4,the disputes application shall comply with the corporate standards for user interface creation for internally and externally used applications,FR,0,1,0,1,0,0
8,the server will support a maximum of 1 000 simultaneous users,FR,0,1,0,1,0,0
6,the product must be able to interface with various email servers the product shall be able to send email,FR,0,1,0,1,0,0
5,the adjuster shall enter the preferred repair facility on the estimate assignment,FR,1,0,1,0,0,0
4,all business rules specified in the disputes system shall be in compliance with the merchant operating regulations,FR,0,1,0,1,0,0
10,for each shot the product shall examine the defensive grid of the defensive player to determine whether the shot was a hit or miss,FR,1,0,1,0,0,0
6,the product must be designed using design patterns and coding best practices 90 of maintenance software developers are able to integrate new functionality into the product with 2 working days,FR,0,1,0,1,0,0
13,the system shall be displayable on any work computer a ccr user may have the system interface shall be formatted to display at 800 by 600 pixel resolution,FR,0,1,0,1,0,0
4,the disputes applications shall interface with the merchant information database the merchant information database provides detailed information with regard to the merchant all merchant detail information shall be obtained from the merchant information database,FR,0,1,0,1,0,0
2,the user interface shall have standard menus buttons for navigation,FR,0,1,0,1,0,0
3,the system shall achieve 95 up time,FR,0,1,0,1,0,0
15,the rfs system should be available 24 7 especially during the budgeting period the rfs system shall be available 90 of the time all year and 98 during the budgeting period 2 of the time the system will become available within 1 hour of the time that the situation is reported,FR,0,1,0,1,0,0
2,the system shall be intuitive and self explanatory,FR,0,1,0,1,0,0
6,a database management system such as oracle db2 mysql or hsql will need to be integrated with the product,FR,0,1,0,1,0,0
14,the commissioner will be the only authorized user per league to adjust league settings,FR,0,1,0,1,0,0
8,daily usage statistics should be logged and accessible by the administrator,FR,1,1,0,0,1,0
8,only registered customers can purchase streaming movies,FR,0,1,0,1,0,0
3,the verbiage used within the system shall be consistent with standard english and the terminology of the national nursing community,FR,0,1,0,1,0,0
4,the disputes system shall record the name of the user and the date for any activity that creates or modifies the disputes case in the system a detailed history of the actions taken on the case including the date and the user that performed the action must be maintained for auditing purposes,FR,1,0,1,0,0,0
9,no lead evaluation will complete in a time period longer than 25 seconds for 97 of all leads processed,FR,0,1,0,1,0,0
2,the system shall be able to call the seller or buyer to schedule an appointment,FR,1,0,1,0,0,0
12,the product shall be robust the product shall have fault avoidance based on standards adoption,FR,0,1,0,1,0,0
3,the system shall operate within the windows xp professional operating system,FR,0,1,0,1,0,0
7,product formula substitutionary ingredients shall be entered automatically by the pfe subsystem,FR,1,0,1,0,0,0
10,the product shall prevent a player from viewing the offensive or defensive grids of the other player,FR,1,0,1,0,0,0
5,the product shall achieve a 98 uptime the product shall not fail more than 2 of the available online time,FR,0,1,0,1,0,0
6,the product must be highly configurable for use with various database management systems for the end users 80 of end users are able to integrate new database management systems with the product without changing the product s software code,FR,0,1,0,1,0,0
1,the system shall link events back to either the sync matrix 1 0 or the exercise managment tool 1 0 applications for modifications,FR,1,1,0,0,1,0
4,the disputes application shall ensure that only authorized users are allowed to logon to the application,FR,0,1,0,1,0,0
10,if the shot was marked as a miss the product shall change the status of the defensive player to offensive,FR,1,0,1,0,0,0
4,the maximum wait time for a user navigating from one screen to another within the disputes application shall be no more than 5 seconds,FR,0,1,0,1,0,0
3,program administrators nursing staff members are the only people who shall have access to clinical site details,FR,0,1,0,1,0,0
8,while streaming a movie buffering should only occur if there is latency in the user s connection,FR,0,1,0,1,0,0
6,the product shall be able to store new room equipment,FR,1,0,1,0,0,0
3,program administrators nursing staff members shall have the ability to modify information relating to a clinical lab section including the clinical site name the department section for the lab the class instructor day and time of lab and contact information,FR,1,0,1,0,0,0
7,pme subsystem shall allow for a product to exist in more than one submenu,FR,1,0,1,0,0,0
5,the average number of recycled parts records per day shall be 50 000,FR,0,1,0,1,0,0
3,the system shall cater to 10 simultaneous users from 9am to 5pm,FR,0,1,0,1,0,0
6,the product shall be available for distribution via the internet as a binary or zip file,FR,0,1,0,1,0,0
5,the estimator shall apply selected recycled parts to the collision estimate,FR,1,0,1,0,0,0
4,the disputes application must maintain a detailed history of every action that a user takes on a dispute case this ensures a complete audit trail if questions arise later on with regard to a particular dispute case,FR,1,1,0,0,1,0
5,the system shall return a list of repair facilities within the radius if the preferred repair facility cannot be determined,FR,1,0,1,0,0,0
6,the product will record meeting acknowledgements,FR,1,0,1,0,0,0
8,the website will allow customers to search for movies by title actor or director,FR,1,0,1,0,0,0
3,program administrators and nursing staff members shall be able to add a new clinical lab section for an existing clinical class into the system,FR,1,0,1,0,0,0
7,the rms system shall have windows xp look and feel and use gui futures making its use intuitive,FR,0,1,0,1,0,0
8,system shall let customers register on the website as a pay as you go user in under 5 minutes,FR,1,1,0,0,1,0
3,only authorized users shall have access to students personal information,FR,0,1,0,1,0,0
2,the system shall update or create new property listings in the mls,FR,1,0,1,0,0,0
5,the audit report shall be available to other adjusters at later points in time,FR,1,0,1,0,0,0
8,the system will provide a 24 hour 800 toll free number for support to its customers,FR,0,1,0,1,0,0
11,the system shall be easy to use by callers and supervisors callers and supervisors must be able to accomplish any system task within 2 minutes,FR,0,1,0,1,0,0
6,the product must be able to interface with various database management systems the product shall communicate successfully with the database management system on 100 of all transactions,FR,0,1,0,1,0,0
7,the system shall generate inventory quantity adjustment document based on product daily sales data and product formulas,FR,1,0,1,0,0,0
8,the website shall not be offensive to religious or ethnic groups,FR,0,1,0,1,0,0
4,the disputes system shall provide view access capability for authorized users of the application,FR,0,1,0,1,0,0
8,the website shall achieve 99 5 up time,FR,0,1,0,1,0,0
4,the disputes system must provide the user the ability to initiate a single dispute case on multiple transactions that belong to a single merchant,FR,1,0,1,0,0,0
4,the disputes application shall support 350 concurrent users without any degradation of performance in the application,FR,0,1,0,1,0,0
5,for estimators the product shall be able to be operated in a repair facility during dirty and noisy conditions,FR,0,1,0,1,0,0
8,the website should use flash to provide animation on the home page,FR,0,1,0,1,0,0
4,all additions of new users and modifications to user s access shall be recorded on the user report,FR,1,0,1,0,0,0
8,website must interface with the cybersource api to process credit card transactions,FR,0,1,0,1,0,0
8,the website shall be attractive to all audiences the website shall appear to be fun and the colors should be bright and vibrant,FR,0,1,0,1,0,0
9,if the leads score falls within the low average then it will be returned to the supplying vendor,FR,1,0,1,0,0,0
1,the product shall be available during normal business hours as long as the user has access to the client pc the system will be available 99 of the time during the first six months of operation,FR,0,1,0,1,0,0
13,the wcs system shall use appropriate nomenclature and terminology as defined by the corporate community grants organization all interfaces and reports will undergo usability tests by ccr users,FR,0,1,0,1,0,0
6,the customer shall be able to easily integrate new building maps with the product throughout the product s lifecycle integration of new maps with the product shall be possible with little to no support from product support staff,FR,0,1,0,1,0,0
5,users shall feel satisfied using the product 85 of all users will be satisfied with the product,FR,0,1,0,1,0,0
6,the product will function alongside server software on any operating system where the java runtime can be installed,FR,0,1,0,1,0,0
7,product formula ingredients shall allow defining substitutionary ingredients,FR,1,0,1,0,0,0
4,the disputes system must provide different levels of access with regard to disputes case initiation and follow up actions,FR,0,1,0,1,0,0
1,the system shall display the local and exercise time in separate clocks,FR,1,0,1,0,0,0
3,a cohort shall be associated to one program of study offered by the department,FR,1,0,1,0,0,0
5,only valid data shall be entered into the system no invalid data shall be entered into the system,FR,0,1,0,1,0,0
11,the interface shall have a simple look in the interface and usability survey 90 of beta testers must report that the interface is adequately simple,FR,0,1,0,1,0,0
6,the product shall be able to send meeting notifications via different kinds of end user specified methods,FR,1,0,1,0,0,0
10,when the offensive player takes a shot the product shall simulate the sound of a ship at sea,FR,1,1,0,0,1,0
3,a program of study shall consist of a program name and listing of required classes both clinical and non clinical that must be completed,FR,0,0,0,0,0,1
6,the product shall assign the organizers contact information to each meeting they create,FR,1,0,1,0,0,0
12,the product shall provide gui based monitoring services system administrators shall monitor message exchanges will predict and determine problems and will also provide internal and external support,FR,1,1,0,0,1,0
13,the wcs system shall be run in a windows environment the wcs shall be accessed by users through the internet on an ibm computer running a windows 2000 or above operating system,FR,0,1,0,1,0,0
3,program administrators and nursing staff members shall be able to add new classes for the nursing department into the system,FR,1,0,1,0,0,0
3,the system shall help the user avoid making mistakes while scheduling classes and clinicals for the nursing students,FR,0,1,0,1,0,0
5,the product shall comply with corporate color scheme,FR,0,1,0,1,0,0
14,users shall be able to view at least 25 nfl player statistics and points on each page,FR,1,1,0,0,1,0
8,when streaming a movie the buffering time should take no longer than 10 seconds plus any latency on the user s connection,FR,0,1,0,1,0,0
13,the system must use a point and click interface 100 of all selection and navigation functionality must be able to be activated selected by either a mouse or a keyboard,FR,0,1,0,1,0,0
